{
  "$schema": "schemas/portfolio-capability.schema.json",
  "schema_version": "2.0.0",
  "registry_id": "lowelltwong-alt.portfolio-capability-evidence.v3",
  "observed_at": "2026-09-10T15:07:21Z",
  "controlled_aliases": [
    "graph_engineering",
    "knowledge_graphs",
    "mcp_server",
    "headless_ai_operations",
    "multi_agent_workflows",
    "agent_mesh",
    "agent_swarm_workflows",
    "deterministic_harnesses",
    "probabilistic_evaluation",
    "end_to_end_build",
    "ai_governance",
    "skill_supply_chain"
  ],
  "capabilities": [
    {
      "alias": "graph_engineering",
      "status": "evidence_backed_public",
      "description": "Governed graph-substrate work with provenance and validation boundaries, including Mini-DAD's typed asset graph.",
      "claim_ids": [
        "repo.scripture_graph.scope",
        "repo.orphan.scope",
        "repo.albert_copilot.scope"
      ],
      "source_repositories": [
        "logos-scripture-graph",
        "LawFirm-os-semantic-substrate",
        "orphan-radar",
        "albert-copilot-studio-design"
      ],
      "evidence_routes": [
        {
          "repository": "logos-scripture-graph",
          "sha": "c6982050a0a8f1b9508e1d2c5b767513bc92d2fa",
          "canonical_path": "schemas/graph_edge_record.schema.json",
          "canonical_url": "https://github.com/lowelltwong-alt/logos-scripture-graph/blob/c6982050a0a8f1b9508e1d2c5b767513bc92d2fa/schemas/graph_edge_record.schema.json",
          "observation_time": "2026-08-27T20:26:19Z",
          "evidence_class": "source_owned_public",
          "access_level": "anonymous_public",
          "source_owned": true,
          "generated": false,
          "non_claims": [
            "Source path only; no run-result claim."
          ]
        },
        {
          "repository": "LawFirm-os-semantic-substrate",
          "sha": "54bdb2ac5261d5626e3fa946a2c18ff2b677ea08",
          "canonical_path": "scripts/phase3/check_graph_partitions.py",
          "canonical_url": "https://github.com/lowelltwong-alt/LawFirm-os-semantic-substrate/blob/54bdb2ac5261d5626e3fa946a2c18ff2b677ea08/scripts/phase3/check_graph_partitions.py",
          "observation_time": "2026-08-27T20:26:19Z",
          "evidence_class": "source_owned_public",
          "access_level": "anonymous_public",
          "source_owned": true,
          "generated": false,
          "non_claims": [
            "Source path only; no run-result claim."
          ]
        },
        {
          "repository": "orphan-radar",
          "sha": "9d2e0a271f82e141db65124a20534738db7be1e7",
          "canonical_path": "src/orphan_radar/graph/build_graph.py",
          "canonical_url": "https://github.com/lowelltwong-alt/orphan-radar/blob/9d2e0a271f82e141db65124a20534738db7be1e7/src/orphan_radar/graph/build_graph.py",
          "observation_time": "2026-08-27T20:26:19Z",
          "evidence_class": "source_owned_public",
          "access_level": "anonymous_public",
          "source_owned": true,
          "generated": false,
          "non_claims": [
            "Source path only; no run-result claim."
          ]
        },
        {
          "sha": "0c78ce325f8f71a0dd8dd3ae4a22fa44be681576",
          "canonical_path": "Extras/Mini DAD/AI_FRONT_DOOR.md",
          "canonical_url": "https://github.com/lowelltwong-alt/albert-copilot-studio-design/blob/0c78ce325f8f71a0dd8dd3ae4a22fa44be681576/Extras/Mini%20DAD/AI_FRONT_DOOR.md",
          "observation_time": "2026-09-10T15:07:21Z",
          "evidence_class": "source_owned_public",
          "access_level": "anonymous_public",
          "source_owned": true,
          "generated": false,
          "non_claims": [
            "Local implementation evidence; no Azure deployment, tenant acceptance, or automatic lesson promotion is claimed."
          ],
          "repository": "albert-copilot-studio-design"
        },
        {
          "sha": "0c78ce325f8f71a0dd8dd3ae4a22fa44be681576",
          "canonical_path": "Extras/Mini DAD/runtime.py",
          "canonical_url": "https://github.com/lowelltwong-alt/albert-copilot-studio-design/blob/0c78ce325f8f71a0dd8dd3ae4a22fa44be681576/Extras/Mini%20DAD/runtime.py",
          "observation_time": "2026-09-10T15:07:21Z",
          "evidence_class": "source_owned_public",
          "access_level": "anonymous_public",
          "source_owned": true,
          "generated": false,
          "non_claims": [
            "Local runtime source; no public service or production deployment is claimed."
          ],
          "repository": "albert-copilot-studio-design"
        }
      ],
      "access": "anonymous_public",
      "non_claims": [
        "No deployment claim.",
        "Albert tenant acceptance, Azure deployment, production use, and autonomous operation are not claimed."
      ]
    },
    {
      "alias": "knowledge_graphs",
      "status": "evidence_backed_public",
      "description": "Public Scripture-graph and local note-graph routes.",
      "claim_ids": [
        "repo.scripture_graph.scope",
        "repo.orphan.scope"
      ],
      "source_repositories": [
        "logos-scripture-graph",
        "orphan-radar"
      ],
      "evidence_routes": [
        {
          "repository": "logos-scripture-graph",
          "sha": "c6982050a0a8f1b9508e1d2c5b767513bc92d2fa",
          "canonical_path": "schemas/graph_edge_record.schema.json",
          "canonical_url": "https://github.com/lowelltwong-alt/logos-scripture-graph/blob/c6982050a0a8f1b9508e1d2c5b767513bc92d2fa/schemas/graph_edge_record.schema.json",
          "observation_time": "2026-08-27T20:26:19Z",
          "evidence_class": "source_owned_public",
          "access_level": "anonymous_public",
          "source_owned": true,
          "generated": false,
          "non_claims": [
            "Source path only; no run-result claim."
          ]
        },
        {
          "repository": "orphan-radar",
          "sha": "9d2e0a271f82e141db65124a20534738db7be1e7",
          "canonical_path": "src/orphan_radar/core/pipeline.py",
          "canonical_url": "https://github.com/lowelltwong-alt/orphan-radar/blob/9d2e0a271f82e141db65124a20534738db7be1e7/src/orphan_radar/core/pipeline.py",
          "observation_time": "2026-08-27T20:26:19Z",
          "evidence_class": "source_owned_public",
          "access_level": "anonymous_public",
          "source_owned": true,
          "generated": false,
          "non_claims": [
            "Source path only; no run-result claim."
          ]
        }
      ],
      "access": "anonymous_public",
      "non_claims": [
        "No LLM evaluation."
      ]
    },
    {
      "alias": "mcp_server",
      "status": "bounded_public_reference",
      "description": "Public Mini-DAD local MCP stdio implementation, plus the access-controlled private DAD MCP route.",
      "claim_ids": [
        "private.dad.scope",
        "repo.albert_copilot.scope"
      ],
      "source_repositories": [
        "Digital Asset Directory",
        "albert-copilot-studio-design"
      ],
      "evidence_routes": [
        {
          "sha": "not_public",
          "canonical_path": "src/digital_asset_directory/mcp_server.py",
          "canonical_url": "https://github.com/lowelltwong-alt/Digital-Assett-Directory",
          "observation_time": "2026-08-27T20:03:00Z",
          "evidence_class": "owner_approved_private_reference",
          "access_level": "after_authorized_access",
          "source_owned": false,
          "generated": false,
          "non_claims": [
            "No anonymous public proof.",
            "Runtime and deployment unasserted."
          ],
          "repository": "Digital Asset Directory"
        },
        {
          "sha": "0c78ce325f8f71a0dd8dd3ae4a22fa44be681576",
          "canonical_path": "Extras/Mini DAD/AI_FRONT_DOOR.md",
          "canonical_url": "https://github.com/lowelltwong-alt/albert-copilot-studio-design/blob/0c78ce325f8f71a0dd8dd3ae4a22fa44be681576/Extras/Mini%20DAD/AI_FRONT_DOOR.md",
          "observation_time": "2026-09-10T15:07:21Z",
          "evidence_class": "source_owned_public",
          "access_level": "anonymous_public",
          "source_owned": true,
          "generated": false,
          "non_claims": [
            "Local implementation evidence; no Azure deployment, tenant acceptance, or automatic lesson promotion is claimed."
          ],
          "repository": "albert-copilot-studio-design"
        },
        {
          "sha": "0c78ce325f8f71a0dd8dd3ae4a22fa44be681576",
          "canonical_path": "Extras/Mini DAD/mcp_stdio.py",
          "canonical_url": "https://github.com/lowelltwong-alt/albert-copilot-studio-design/blob/0c78ce325f8f71a0dd8dd3ae4a22fa44be681576/Extras/Mini%20DAD/mcp_stdio.py",
          "observation_time": "2026-09-10T15:07:21Z",
          "evidence_class": "source_owned_public",
          "access_level": "anonymous_public",
          "source_owned": true,
          "generated": false,
          "non_claims": [
            "Local MCP stdio source; no remote public MCP service is claimed."
          ],
          "repository": "albert-copilot-studio-design"
        },
        {
          "sha": "0c78ce325f8f71a0dd8dd3ae4a22fa44be681576",
          "canonical_path": "Extras/Mini DAD/network_adapter.py",
          "canonical_url": "https://github.com/lowelltwong-alt/albert-copilot-studio-design/blob/0c78ce325f8f71a0dd8dd3ae4a22fa44be681576/Extras/Mini%20DAD/network_adapter.py",
          "observation_time": "2026-09-10T15:07:21Z",
          "evidence_class": "source_owned_public",
          "access_level": "anonymous_public",
          "source_owned": true,
          "generated": false,
          "non_claims": [
            "API-key adapter source; Entra or OAuth validation is not claimed."
          ],
          "repository": "albert-copilot-studio-design"
        }
      ],
      "access": "mixed",
      "non_claims": [
        "No execution authority.",